CVE-2017-18249	2018-03-26	2019-04-03	7.0	0.04%			The add_free_nid function in fs/f2fs/node.c in the Linux kernel before 4.12 does not properly track an allocated nid, which allows local users to cause a denial of service (race condition) or possibly have unspecified other impact via concurrent threads.
CVE-2017-18241	2018-03-21	2019-03-18	5.5	0.04%			fs/f2fs/segment.c in the Linux kernel before 4.13 allows local users to cause a denial of service (NULL pointer dereference and panic) by using a noflush_merge option that triggers a NULL value for a flush_cmd_control data structure.
CVE-2017-18232	2018-03-15	2019-10-03	5.5	0.04%			The Serial Attached SCSI (SAS) implementation in the Linux kernel through 4.15.9 mishandles a mutex within libsas, which allows local users to cause a denial of service (deadlock) by triggering certain error-handling code.
CVE-2017-18224	2018-03-12	2018-05-03	4.7	0.04%			In the Linux kernel before 4.15, fs/ocfs2/aops.c omits use of a semaphore and consequently has a race condition for access to the extent tree during read operations in DIRECT mode, which allows local users to cause a denial of service (BUG) by modifying a certain e_cpos field.
CVE-2017-18222	2018-03-08	2018-05-24	7.8	0.04%			In the Linux kernel before 4.12, Hisilicon Network Subsystem (HNS) does not consider the ETH_SS_PRIV_FLAGS case when retrieving sset_count data, which allows local users to cause a denial of service (buffer overflow and memory corruption) or possibly have unspecified other impact, as demonstrated by incompatibility between hns_get_sset_count and ethtool_get_strings.
CVE-2017-18221	2018-03-07	2018-05-31	5.5	0.04%			The __munlock_pagevec function in mm/mlock.c in the Linux kernel before 4.11.4 allows local users to cause a denial of service (NR_MLOCK accounting corruption) via crafted use of mlockall and munlockall system calls.
CVE-2017-18218	2018-03-05	2023-02-07	7.8	0.04%			In drivers/net/ethernet/hisilicon/hns/hns_enet.c in the Linux kernel before 4.13, local users can cause a denial of service (use-after-free and BUG) or possibly have unspecified other impact by leveraging differences in skb handling between hns_nic_net_xmit_hw and hns_nic_net_xmit.
CVE-2017-18216	2018-03-05	2018-10-30	5.5	0.04%			In fs/ocfs2/cluster/nodemanager.c in the Linux kernel before 4.15, local users can cause a denial of service (NULL pointer dereference and BUG) because a required mutex is not used.
CVE-2017-18208	2018-03-01	2019-10-03	5.5	0.04%			The madvise_willneed function in mm/madvise.c in the Linux kernel before 4.14.4 allows local users to cause a denial of service (infinite loop) by triggering use of MADVISE_WILLNEED for a DAX mapping.
CVE-2017-18204	2018-02-27	2019-10-03	5.5	0.04%			The ocfs2_setattr function in fs/ocfs2/file.c in the Linux kernel before 4.14.2 allows local users to cause a denial of service (deadlock) via DIO requests.
CVE-2017-18203	2018-02-27	2018-06-20	4.7	0.04%			The dm_get_from_kobject function in drivers/md/dm.c in the Linux kernel before 4.14.3 allow local users to cause a denial of service (BUG) by leveraging a race condition with __dm_destroy during creation and removal of DM devices.
CVE-2017-18202	2018-02-27	2023-06-21	7.0	0.06%			The __oom_reap_task_mm function in mm/oom_kill.c in the Linux kernel before 4.14.4 mishandles gather operations, which allows attackers to cause a denial of service (TLB entry leak or use-after-free) or possibly have unspecified other impact by triggering a copy_to_user call within a certain time window.
CVE-2017-18200	2018-02-26	2018-03-16	5.5	0.04%			The f2fs implementation in the Linux kernel before 4.14 mishandles reference counts associated with f2fs_wait_discard_bios calls, which allows local users to cause a denial of service (BUG), as demonstrated by fstrim.
CVE-2017-18193	2018-02-22	2018-05-24	5.5	0.04%			fs/f2fs/extent_cache.c in the Linux kernel before 4.13 mishandles extent trees, which allows local users to cause a denial of service (BUG) via an application with multiple threads.
CVE-2017-18174	2018-02-11	2018-12-21	9.8	0.70%			In the Linux kernel before 4.7, the amd_gpio_remove function in drivers/pinctrl/pinctrl-amd.c calls the pinctrl_unregister function, leading to a double free.
CVE-2017-18079	2018-01-29	2023-02-07	7.8	0.06%			drivers/input/serio/i8042.c in the Linux kernel before 4.12.4 allows attackers to cause a denial of service (NULL pointer dereference and system crash) or possibly have unspecified other impact because the port->exists value can change after it is validated.
CVE-2017-18075	2018-01-24	2023-02-07	7.8	0.04%			crypto/pcrypt.c in the Linux kernel before 4.14.13 mishandles freeing instances, allowing a local user able to access the AF_ALG-based AEAD interface (CONFIG_CRYPTO_USER_API_AEAD) and pcrypt (CONFIG_CRYPTO_PCRYPT) to cause a denial of service (kfree of an incorrect pointer) or possibly have unspecified other impact by executing a crafted sequence of system calls.
CVE-2017-18017	2018-01-03	2023-01-19	10.0	96.14%			The tcpmss_mangle_packet function in net/netfilter/xt_TCPMSS.c in the Linux kernel before 4.11, and 4.9.x before 4.9.36, allows remote attackers to cause a denial of service (use-after-free and memory corruption) or possibly have unspecified other impact by leveraging the presence of xt_TCPMSS in an iptables action.
CVE-2017-16914	2018-01-31	2018-08-24	7.1	1.16%			The "stub_send_ret_submit()" function (drivers/usb/usbip/stub_tx.c) in the Linux Kernel before version 4.14.8, 4.9.71, 4.1.49, and 4.4.107 allows attackers to cause a denial of service (NULL pointer dereference) via a specially crafted USB over IP packet.
CVE-2017-16913	2018-01-31	2018-08-24	7.1	1.01%			The "stub_recv_cmd_submit()" function (drivers/usb/usbip/stub_rx.c) in the Linux Kernel before version 4.14.8, 4.9.71, and 4.4.114 when handling CMD_SUBMIT packets allows attackers to cause a denial of service (arbitrary memory allocation) via a specially crafted USB over IP packet.
CVE-2017-16912	2018-01-31	2018-08-24	7.1	0.54%			The "get_pipe()" function (drivers/usb/usbip/stub_rx.c) in the Linux Kernel before version 4.14.8, 4.9.71, and 4.4.114 allows attackers to cause a denial of service (out-of-bounds read) via a specially crafted USB over IP packet.
CVE-2017-16911	2018-01-31	2018-08-24	4.7	0.04%			The vhci_hcd driver in the Linux Kernel before version 4.14.8 and 4.4.114 allows allows local attackers to disclose kernel memory addresses. Successful exploitation requires that a USB device is attached over IP.
CVE-2017-15129	2018-01-09	2023-02-12	5.5	0.04%			A use-after-free vulnerability was found in network namespaces code affecting the Linux kernel before 4.14.11. The function get_net_ns_by_id() in net/core/net_namespace.c does not check for the net::count value after it has found a peer network in netns_ids idr, which could lead to double free and memory corruption. This vulnerability could allow an unprivileged local user to induce kernel memory corruption on the system, leading to a crash. Due to the nature of the flaw, privilege escalation cannot be fully ruled out, although it is thought to be unlikely.
CVE-2017-15128	2018-01-14	2021-07-15	5.5	0.06%			A flaw was found in the hugetlb_mcopy_atomic_pte function in mm/hugetlb.c in the Linux kernel before 4.13.12. A lack of size check could cause a denial of service (BUG).
CVE-2017-15127	2018-01-14	2023-02-12	5.5	0.04%			A flaw was found in the hugetlb_mcopy_atomic_pte function in mm/hugetlb.c in the Linux kernel before 4.13. A superfluous implicit page unlock for VM_SHARED hugetlbfs mapping could trigger a local denial of service (BUG).
CVE-2017-15126	2018-01-14	2023-02-12	9.3	2.53%			A use-after-free flaw was found in fs/userfaultfd.c in the Linux kernel before 4.13.6. The issue is related to the handling of fork failure when dealing with event messages. Failure to fork correctly can lead to a situation where a fork event will be removed from an already freed list of events with userfaultfd_ctx_put().
CVE-2017-7558	2018-07-26	2023-02-12	7.5	2.69%			A kernel data leak due to an out-of-bound read was found in the Linux kernel in inet_diag_msg_sctp{,l}addr_fill() and sctp_get_sctp_info() functions present since version 4.7-rc1 through version 4.13. A data leak happens when these functions fill in sockaddr data structures used to export socket's diagnostic information. As a result, up to 100 bytes of the slab data could be leaked to a userspace.
CVE-2017-7518	2018-07-30	2019-10-09	7.8	0.06%			A flaw was found in the Linux kernel before version 4.12 in the way the KVM module processed the trap flag(TF) bit in EFLAGS during emulation of the syscall instruction, which leads to a debug exception(#DB) being raised in the guest stack. A user/process inside a guest could use this flaw to potentially escalate their privileges inside the guest. Linux guests are not affected by this.
CVE-2017-7482	2018-07-30	2023-02-14	7.8	0.06%			In the Linux kernel before version 4.12, Kerberos 5 tickets decoded when using the RXRPC keys incorrectly assumes the size of a field. This could lead to the size-remaining variable wrapping and the data pointer going over the end of the buffer. This could possibly lead to memory corruption and possible privilege escalation.
CVE-2017-2634	2018-07-27	2023-02-12	7.8	3.54%			It was found that the Linux kernel's Datagram Congestion Control Protocol (DCCP) implementation before 2.6.22.17 used the IPv4-only inet_sk_rebuild_header() function for both IPv4 and IPv6 DCCP connections, which could result in memory corruptions. A remote attacker could use this flaw to crash the system.
CVE-2017-2618	2018-07-27	2023-02-12	5.5	0.06%			A flaw was found in the Linux kernel's handling of clearing SELinux attributes on /proc/pid/attr files before 4.9.10. An empty (null) write to this file can crash the system by causing the system to attempt to access unmapped kernel memory.
CVE-2016-10723	2018-06-21	2018-08-21	5.5	0.05%			** DISPUTED ** An issue was discovered in the Linux kernel through 4.17.2. Since the page allocator does not yield CPU resources to the owner of the oom_lock mutex, a local unprivileged user can trivially lock up the system forever by wasting CPU resources from the page allocator (e.g., via concurrent page fault events) when the global OOM killer is invoked. NOTE: the software maintainer has not accepted certain proposed patches, in part because of a viewpoint that "the underlying problem is non-trivial to handle."
CVE-2016-9604	2018-07-11	2019-10-09	4.4	0.06%			It was discovered in the Linux kernel before 4.11-rc8 that root can gain direct access to an internal keyring, such as '.dns_resolver' in RHEL-7 or '.builtin_trusted_keys' upstream, by joining it as its session keyring. This allows root to bypass module signature verification by adding a new public key of its own devising to the keyring.
CVE-2014-8171	2018-02-09	2023-02-13	5.5	0.04%			The memory resource controller (aka memcg) in the Linux kernel allows local users to cause a denial of service (deadlock) by spawning new processes within a memory-constrained cgroup.
