CVE-2018-12633	2018-06-22	2018-08-21	6.3	0.04%			An issue was discovered in the Linux kernel through 4.17.2. vbg_misc_device_ioctl() in drivers/virt/vboxguest/vboxguest_linux.c reads the same user data twice with copy_from_user. The header part of the user data is double-fetched, and a malicious user thread can tamper with the critical variables (hdr.size_in and hdr.size_out) in the header between the two fetches because of a race condition, leading to severe kernel errors, such as buffer over-accesses. This bug can cause a local denial of service and information leakage.
CVE-2018-12233	2018-06-12	2019-03-27	7.8	0.19%			In the ea_get function in fs/jfs/xattr.c in the Linux kernel through 4.17.1, a memory corruption bug in JFS can be triggered by calling setxattr twice with two different extended attribute names on the same file. This vulnerability can be triggered by an unprivileged user with the ability to create files and execute programs. A kmalloc call is incorrect, leading to slab-out-of-bounds in jfs_xattr.
CVE-2018-12232	2018-06-12	2018-10-31	7.1	1.08%			In net/socket.c in the Linux kernel through 4.17.1, there is a race condition between fchownat and close in cases where they target the same socket file descriptor, related to the sock_close and sockfs_setattr functions. fchownat does not increment the file descriptor reference count, which allows close to set the socket to NULL during fchownat's execution, leading to a NULL pointer dereference and system crash.
CVE-2018-11508	2018-05-28	2019-03-27	5.5	0.05%			The compat_get_timex function in kernel/compat.c in the Linux kernel before 4.16.9 allows local users to obtain sensitive information from kernel memory via adjtimex.
CVE-2018-11506	2018-05-28	2023-02-24	7.8	0.04%			The sr_do_ioctl function in drivers/scsi/sr_ioctl.c in the Linux kernel through 4.16.12 allows local users to cause a denial of service (stack-based buffer overflow) or possibly have unspecified other impact because sense buffers have different sizes at the CDROM layer and the SCSI layer, as demonstrated by a CDROMREADMODE2 ioctl call.
CVE-2018-11412	2018-05-24	2019-03-15	5.9	3.16%			In the Linux kernel 4.13 through 4.16.11, ext4_read_inline_data() in fs/ext4/inline.c performs a memcpy with an untrusted length value in certain circumstances involving a crafted filesystem that stores the system.data extended attribute value in a dedicated inode.
CVE-2018-11232	2018-05-18	2018-06-19	5.5	0.05%			The etm_setup_aux function in drivers/hwtracing/coresight/coresight-etm-perf.c in the Linux kernel before 4.10.2 allows attackers to cause a denial of service (panic) because a parameter is incorrectly used as a local variable.
CVE-2018-10940	2018-05-09	2018-10-31	5.5	0.04%			The cdrom_ioctl_media_changed function in drivers/cdrom/cdrom.c in the Linux kernel before 4.16.6 allows local attackers to use a incorrect bounds check in the CDROM driver CDROM_MEDIA_CHANGED ioctl to read out kernel memory.
CVE-2018-10938	2018-08-27	2019-10-03	7.1	6.28%			A flaw was found in the Linux kernel present since v4.0-rc1 and through v4.13-rc4. A crafted network packet sent remotely by an attacker may force the kernel to enter an infinite loop in the cipso_v4_optptr() function in net/ipv4/cipso_ipv4.c leading to a denial-of-service. A certain non-default configuration of LSM (Linux Security Module) and NetLabel should be set up on a system before an attacker could leverage this flaw.
CVE-2018-10902	2018-08-21	2023-02-12	7.8	0.04%			It was found that the raw midi kernel driver does not protect against concurrent access which leads to a double realloc (double free) in snd_rawmidi_input_params() and snd_rawmidi_output_status() which are part of snd_rawmidi_ioctl() handler in rawmidi.c file. A malicious local attacker could possibly use this for privilege escalation.
CVE-2018-10901	2018-07-26	2023-02-24	7.8	0.06%			A flaw was found in Linux kernel's KVM virtualization subsystem. The VMX code does not restore the GDT.LIMIT to the previous host value, but instead sets it to 64KB. With a corrupted GDT limit a host's userspace code has an ability to place malicious entries in the GDT, particularly to the per-cpu variables. An attacker can use this to escalate their privileges.
CVE-2018-10883	2018-07-30	2023-02-12	5.5	0.04%			A flaw was found in the Linux kernel's ext4 filesystem. A local user can cause an out-of-bounds write in jbd2_journal_dirty_metadata(), a denial of service, and a system crash by mounting and operating on a crafted ext4 filesystem image.
CVE-2018-10882	2018-07-27	2023-02-12	5.5	0.04%			A flaw was found in the Linux kernel's ext4 filesystem. A local user can cause an out-of-bound write in in fs/jbd2/transaction.c code, a denial of service, and a system crash by unmounting a crafted ext4 filesystem image.
CVE-2018-10881	2018-07-26	2023-02-12	5.5	0.04%			A flaw was found in the Linux kernel's ext4 filesystem. A local user can cause an out-of-bound access in ext4_get_group_info function, a denial of service, and a system crash by mounting and operating on a crafted ext4 filesystem image.
CVE-2018-10880	2018-07-25	2023-02-13	7.1	0.10%			Linux kernel is vulnerable to a stack-out-of-bounds write in the ext4 filesystem code when mounting and writing to a crafted ext4 image in ext4_update_inline_data(). An attacker could use this to cause a system crash and a denial of service.
CVE-2018-10879	2018-07-26	2023-02-13	7.8	0.04%			A flaw was found in the Linux kernel's ext4 filesystem. A local user can cause a use-after-free in ext4_xattr_set_entry function and a denial of service or unspecified other impact may occur by renaming a file in a crafted ext4 filesystem image.
CVE-2018-10878	2018-07-26	2023-08-11	7.8	0.04%			A flaw was found in the Linux kernel's ext4 filesystem. A local user can cause an out-of-bounds write and a denial of service or unspecified other impact is possible by mounting and operating a crafted ext4 filesystem image.
CVE-2018-10877	2018-07-18	2023-02-13	7.3	0.06%			Linux kernel ext4 filesystem is vulnerable to an out-of-bound access in the ext4_ext_drop_refs() function when operating on a crafted ext4 filesystem image.
CVE-2018-10876	2018-07-26	2023-02-13	5.5	0.10%			A flaw was found in Linux kernel in the ext4 filesystem code. A use-after-free is possible in ext4_ext_remove_space() function when mounting and operating a crafted ext4 image.
CVE-2018-10853	2018-09-11	2019-10-03	7.8	0.06%			A flaw was found in the way Linux kernel KVM hypervisor before 4.18 emulated instructions such as sgdt/sidt/fxsave/fxrstor. It did not check current privilege(CPL) level while emulating unprivileged instructions. An unprivileged guest user/process could use this flaw to potentially escalate privileges inside guest.
CVE-2018-10840	2018-07-16	2023-02-13	7.2	0.15%			Linux kernel is vulnerable to a heap-based buffer overflow in the fs/ext4/xattr.c:ext4_xattr_set_entry() function. An attacker could exploit this by operating on a mounted crafted ext4 image.
CVE-2018-10675	2018-05-02	2023-02-24	7.8	0.04%			The do_get_mempolicy function in mm/mempolicy.c in the Linux kernel before 4.12.9 allows local users to cause a denial of service (use-after-free) or possibly have unspecified other impact via crafted system calls.
CVE-2018-10323	2018-04-24	2020-09-08	5.5	0.04%			The xfs_bmap_extents_to_btree function in fs/xfs/libxfs/xfs_bmap.c in the Linux kernel through 4.16.3 allows local users to cause a denial of service (xfs_bmapi_write NULL pointer dereference) via a crafted xfs image.
CVE-2018-10322	2018-04-24	2020-10-16	5.5	0.04%			The xfs_dinode_verify function in fs/xfs/libxfs/xfs_inode_buf.c in the Linux kernel through 4.16.3 allows local users to cause a denial of service (xfs_ilock_attr_map_shared invalid pointer dereference) via a crafted xfs image.
CVE-2018-10124	2018-04-16	2019-03-20	5.5	0.04%			The kill_something_info function in kernel/signal.c in the Linux kernel before 4.13, when an unspecified architecture and compiler is used, might allow local users to cause a denial of service via an INT_MIN argument.
CVE-2018-10087	2018-04-13	2019-03-20	5.5	0.04%			The kernel_wait4 function in kernel/exit.c in the Linux kernel before 4.13, when an unspecified architecture and compiler is used, might allow local users to cause a denial of service by triggering an attempted use of the -INT_MIN value.
CVE-2018-10074	2018-04-12	2018-05-22	5.5	0.04%			The hi3660_stub_clk_probe function in drivers/clk/hisilicon/clk-hi3660-stub.c in the Linux kernel before 4.16 allows local users to cause a denial of service (NULL pointer dereference) by triggering a failure of resource retrieval.
CVE-2018-10021	2018-04-11	2019-10-03	5.5	0.04%			** DISPUTED ** drivers/scsi/libsas/sas_scsi_host.c in the Linux kernel before 4.16 allows local users to cause a denial of service (ata qc leak) by triggering certain failure conditions. NOTE: a third party disputes the relevance of this report because the failure can only occur for physically proximate attackers who unplug SAS Host Bus Adapter cables.
CVE-2018-9568	2018-12-06	2023-02-24	7.8	0.04%			In sk_clone_lock of sock.c, there is a possible memory corruption due to type confusion. This could lead to local escalation of privilege with no additional execution privileges needed. User interaction is not needed for exploitation. Product: Android. Versions: Android kernel. Android ID: A-113509306. References: Upstream kernel.
CVE-2018-9363	2018-11-06	2023-01-19	8.4	0.13%			In the hidp_process_report in bluetooth, there is an integer overflow. This could lead to an out of bounds write with no additional execution privileges needed. User interaction is not needed for exploitation. Product: Android Versions: Android kernel Android ID: A-65853588 References: Upstream kernel.
CVE-2018-8822	2018-03-20	2023-03-03	7.8	0.06%			Incorrect buffer length handling in the ncp_read_kernel function in fs/ncpfs/ncplib_kernel.c in the Linux kernel through 4.15.11, and in drivers/staging/ncpfs/ncplib_kernel.c in the Linux kernel 4.16-rc through 4.16-rc6, could be exploited by malicious NCPFS servers to crash the kernel or execute code.
CVE-2018-8781	2018-04-23	2023-03-03	7.8	0.04%			The udl_fb_mmap function in drivers/gpu/drm/udl/udl_fb.c at the Linux kernel version 3.4 and up to and including 4.15 has an integer-overflow vulnerability allowing local users with access to the udldrmfb driver to obtain full read and write permissions on kernel physical pages, resulting in a code execution in kernel space.
CVE-2018-8087	2018-03-13	2019-10-03	5.5	0.04%			Memory leak in the hwsim_new_radio_nl function in drivers/net/wireless/mac80211_hwsim.c in the Linux kernel through 4.15.9 allows local users to cause a denial of service (memory consumption) by triggering an out-of-array error case.
CVE-2018-8043	2018-03-10	2019-03-04	5.5	0.04%			The unimac_mdio_probe function in drivers/net/phy/mdio-bcm-unimac.c in the Linux kernel through 4.15.8 does not validate certain resource availability, which allows local users to cause a denial of service (NULL pointer dereference).
CVE-2018-7995	2018-03-09	2019-02-28	4.7	0.04%			** DISPUTED ** Race condition in the store_int_with_restart() function in arch/x86/kernel/cpu/mcheck/mce.c in the Linux kernel through 4.15.7 allows local users to cause a denial of service (panic) by leveraging root access to write to the check_interval file in a /sys/devices/system/machinecheck/machinecheck<cpu number> directory. NOTE: a third party has indicated that this report is not security relevant.
CVE-2018-7757	2018-03-08	2019-10-03	5.5	0.04%			Memory leak in the sas_smp_get_phy_events function in drivers/scsi/libsas/sas_expander.c in the Linux kernel through 4.15.7 allows local users to cause a denial of service (memory consumption) via many read accesses to files in the /sys/class/sas_phy directory, as demonstrated by the /sys/class/sas_phy/phy-1:0:12/invalid_dword_count file.
CVE-2018-7755	2018-03-08	2018-10-04	5.5	0.08%			An issue was discovered in the fd_locked_ioctl function in drivers/block/floppy.c in the Linux kernel through 4.15.7. The floppy driver will copy a kernel pointer to user memory in response to the FDGETPRM ioctl. An attacker can send the FDGETPRM ioctl and use the obtained kernel pointer to discover the location of kernel code and data and bypass kernel security protections such as KASLR.
CVE-2018-7754	2018-08-10	2020-08-24	5.5	0.04%			The aoedisk_debugfs_show function in drivers/block/aoe/aoeblk.c in the Linux kernel through 4.16.4rc4 allows local users to obtain sensitive address information by reading "ffree: " lines in a debugfs file.
CVE-2018-7740	2018-03-07	2019-03-18	5.5	0.04%			The resv_map_release function in mm/hugetlb.c in the Linux kernel through 4.15.7 allows local users to cause a denial of service (BUG) via a crafted application that makes mmap system calls and has a large pgoff argument to the remap_file_pages system call.
CVE-2018-7566	2018-03-30	2020-08-24	7.8	0.04%			The Linux kernel 4.15 has a Buffer Overflow via an SNDRV_SEQ_IOCTL_SET_CLIENT_POOL ioctl write operation to /dev/snd/seq by a local user.
CVE-2018-7492	2018-02-26	2019-03-26	5.5	0.04%			A NULL pointer dereference was found in the net/rds/rdma.c __rds_rdma_map() function in the Linux kernel before 4.14.7 allowing local attackers to cause a system panic and a denial-of-service, related to RDS_GET_MR and RDS_GET_MR_FOR_DEST.
CVE-2018-7480	2018-02-25	2023-02-24	7.8	0.04%			The blkcg_init_queue function in block/blk-cgroup.c in the Linux kernel before 4.11 allows local users to cause a denial of service (double free) or possibly have unspecified other impact by triggering a creation failure.
CVE-2018-7273	2018-02-21	2019-03-01	5.5	0.15%			In the Linux kernel through 4.15.4, the floppy driver reveals the addresses of kernel functions and global variables using printk calls within the function show_floppy in drivers/block/floppy.c. An attacker can read this information from dmesg and use the addresses to find the locations of kernel code and data and bypass kernel security protections such as KASLR.
CVE-2018-6927	2018-02-12	2019-03-06	7.8	0.06%			The futex_requeue function in kernel/futex.c in the Linux kernel before 4.14.15 might allow attackers to cause a denial of service (integer overflow) or possibly have unspecified other impact by triggering a negative wake or requeue value.
CVE-2018-6559	2018-10-26	2019-10-09	3.3	0.04%			The Linux kernel, as used in Ubuntu 18.04 LTS and Ubuntu 18.10, allows local users to obtain names of files in which they would not normally be able to access via an overlayfs mount inside of a user namespace.
CVE-2018-6555	2018-09-04	2019-10-09	7.8	0.04%			The irda_setsockopt function in net/irda/af_irda.c and later in drivers/staging/irda/net/af_irda.c in the Linux kernel before 4.17 allows local users to cause a denial of service (ias_object use-after-free and system crash) or possibly have unspecified other impact via an AF_IRDA socket.
CVE-2018-6554	2018-09-04	2019-10-09	5.5	0.04%			Memory leak in the irda_bind function in net/irda/af_irda.c and later in drivers/staging/irda/net/af_irda.c in the Linux kernel before 4.17 allows local users to cause a denial of service (memory consumption) by repeatedly binding an AF_IRDA socket.
CVE-2018-6412	2018-01-31	2019-03-20	7.5	0.15%			In the function sbusfb_ioctl_helper() in drivers/video/fbdev/sbuslib.c in the Linux kernel through 4.15, an integer signedness error allows arbitrary information leakage for the FBIOPUTCMAP_SPARC and FBIOGETCMAP_SPARC commands.
CVE-2018-5995	2018-08-07	2019-05-28	5.5	0.04%			The pcpu_embed_first_chunk function in mm/percpu.c in the Linux kernel through 4.14.14 allows local users to obtain sensitive address information by reading dmesg data from a "pages/cpu" printk call.
CVE-2018-5953	2018-08-07	2021-01-28	5.5	0.04%			The swiotlb_print_info function in lib/swiotlb.c in the Linux kernel through 4.14.14 allows local users to obtain sensitive address information by reading dmesg data from a "software IO TLB" printk call.
CVE-2018-5873	2018-07-06	2023-07-19	7.0	0.06%			An issue was discovered in the __ns_get_path function in fs/nsfs.c in the Linux kernel before 4.11. Due to a race condition when accessing files, a Use After Free condition can occur. This also affects all Android releases from CAF using the Linux kernel (Android for MSM, Firefox OS for MSM, QRD Android) before security patch level 2018-07-05.
CVE-2018-5814	2018-06-12	2019-05-20	7.0	0.06%			In the Linux Kernel before version 4.16.11, 4.14.43, 4.9.102, and 4.4.133, multiple race condition errors when handling probe, disconnect, and rebind operations can be exploited to trigger a use-after-free condition or a NULL pointer dereference by sending multiple USB over IP packets.
CVE-2018-5803	2018-06-12	2019-03-27	5.5	0.06%			In the Linux Kernel before version 4.15.8, 4.14.25, 4.9.87, 4.4.121, 4.1.51, and 3.2.102, an error in the "_sctp_make_chunk()" function (net/sctp/sm_make_chunk.c) when handling SCTP packets length can be exploited to cause a kernel crash.
CVE-2018-5750	2018-01-26	2019-03-07	5.5	0.04%			The acpi_smbus_hc_add function in drivers/acpi/sbshc.c in the Linux kernel through 4.14.15 allows local users to obtain sensitive address information by reading dmesg data from an SBS HC printk call.
CVE-2018-5703	2018-01-16	2023-01-19	10.0	0.19%			The tcp_v6_syn_recv_sock function in net/ipv6/tcp_ipv6.c in the Linux kernel through 4.14.11 allows attackers to cause a denial of service (slab out-of-bounds write) or possibly have unspecified other impact via vectors involving TLS.
CVE-2018-5391	2018-09-06	2022-12-28	7.8	1.16%			The Linux kernel, versions 3.9+, is vulnerable to a denial of service attack with low rates of specially modified packets targeting IP fragment re-assembly. An attacker may cause a denial of service condition by sending specially crafted IP fragments. Various vulnerabilities in IP fragmentation have been discovered and fixed over the years. The current vulnerability (CVE-2018-5391) became exploitable in the Linux kernel with the increase of the IP fragment reassembly queue size.
CVE-2018-5390	2018-08-06	2020-09-18	7.8	95.07%			Linux kernel versions 4.9+ can be forced to make very expensive calls to tcp_collapse_ofo_queue() and tcp_prune_ofo_queue() for every incoming packet which can lead to a denial of service.
CVE-2018-5344	2018-01-12	2020-08-24	7.8	0.06%			In the Linux kernel through 4.14.13, drivers/block/loop.c mishandles lo_release serialization, which allows attackers to cause a denial of service (__lock_acquire use-after-free) or possibly have unspecified other impact.
CVE-2018-5333	2018-01-11	2020-01-22	5.5	0.06%		Yes	In the Linux kernel through 4.14.13, the rds_cmsg_atomic function in net/rds/rdma.c mishandles cases where page pinning fails or an invalid address is supplied, leading to an rds_atomic_free_op NULL pointer dereference.
CVE-2018-5332	2018-01-11	2023-02-24	7.8	0.06%			In the Linux kernel through 3.2, the rds_message_alloc_sgs() function does not validate a value that is used during DMA page allocation, leading to a heap-based out-of-bounds write (related to the rds_rdma_extra_size function in net/rds/rdma.c).
CVE-2018-1130	2018-05-10	2019-10-09	5.5	0.04%			Linux kernel before version 4.16-rc7 is vulnerable to a null pointer dereference in dccp_write_xmit() function in net/dccp/output.c in that allows a local user to cause a denial of service by a number of certain crafted system calls.
CVE-2018-1120	2018-06-20	2019-10-09	5.3	0.09%			A flaw was found affecting the Linux kernel before version 4.17. By mmap()ing a FUSE-backed file onto a process's memory containing command line arguments (or environment strings), an attacker can cause utilities from psutils or procps (such as ps, w) or any other program which makes a read() call to the /proc/<pid>/cmdline (or /proc/<pid>/environ) files to block indefinitely (denial of service) or for some controlled time (as a synchronization primitive for other attacks).
CVE-2018-1118	2018-05-10	2023-02-13	5.5	0.04%			Linux kernel vhost since version 4.8 does not properly initialize memory in messages passed between virtual guests and the host operating system in the vhost/vhost.c:vhost_new_msg() function. This can allow local privileged users to read some kernel memory contents when reading from the /dev/vhost-net device file.
CVE-2018-1108	2018-05-21	2022-11-29	5.9	1.09%			kernel drivers before version 4.17-rc1 are vulnerable to a weakness in the Linux kernel's implementation of random seed data. Programs, early in the boot sequence, could use the data allocated for the seed before it was sufficiently generated.
CVE-2018-1095	2018-04-02	2023-02-13	7.1	0.14%			The ext4_xattr_check_entries function in fs/ext4/xattr.c in the Linux kernel through 4.15.15 does not properly validate xattr sizes, which causes misinterpretation of a size as an error code, and consequently allows attackers to cause a denial of service (get_acl NULL pointer dereference and system crash) via a crafted ext4 image.
CVE-2018-1094	2018-04-02	2023-02-13	7.1	0.20%			The ext4_fill_super function in fs/ext4/super.c in the Linux kernel through 4.15.15 does not always initialize the crc32c checksum driver, which allows attackers to cause a denial of service (ext4_xattr_inode_hash NULL pointer dereference and system crash) via a crafted ext4 image.
CVE-2018-1093	2018-04-02	2018-08-29	7.1	0.23%			The ext4_valid_block_bitmap function in fs/ext4/balloc.c in the Linux kernel through 4.15.15 allows attackers to cause a denial of service (out-of-bounds read and system crash) via a crafted ext4 image because balloc.c and ialloc.c do not validate bitmap block numbers.
CVE-2018-1092	2018-04-02	2023-02-12	7.1	0.25%			The ext4_iget function in fs/ext4/inode.c in the Linux kernel through 4.15.15 mishandles the case of a root directory with a zero i_links_count, which allows attackers to cause a denial of service (ext4_process_freed_data NULL pointer dereference and OOPS) via a crafted ext4 image.
CVE-2018-1091	2018-03-27	2018-05-10	5.5	0.06%			In the flush_tmregs_to_thread function in arch/powerpc/kernel/ptrace.c in the Linux kernel before 4.13.5, a guest kernel crash can be triggered from unprivileged userspace during a core dump on a POWER host due to a missing processor feature check and an erroneous use of transactional memory (TM) instructions in the core dump path, leading to a denial of service.
CVE-2018-1087	2018-05-15	2019-10-09	8.0	0.06%			kernel KVM before versions kernel 4.16, kernel 4.16-rc7, kernel 4.17-rc1, kernel 4.17-rc2 and kernel 4.17-rc3 is vulnerable to a flaw in the way the Linux kernel's KVM hypervisor handled exceptions delivered after a stack switch operation via Mov SS or Pop SS instructions. During the stack switch operation, the processor did not deliver interrupts and exceptions, rather they are delivered once the first instruction after the stack switch is executed. An unprivileged KVM guest user could use this flaw to crash the guest or, potentially, escalate their privileges in the guest.
CVE-2018-1068	2018-03-16	2023-06-21	7.2	0.07%			A flaw was found in the Linux 4.x kernel's implementation of 32-bit syscall interface for bridging. This allowed a privileged user to arbitrarily write to a limited range of kernel memory.
CVE-2018-1066	2018-03-02	2019-04-23	7.1	0.67%			The Linux kernel before version 4.11 is vulnerable to a NULL pointer dereference in fs/cifs/cifsencrypt.c:setup_ntlmv2_rsp() that allows an attacker controlling a CIFS server to kernel panic a client that has this server mounted, because an empty TargetInfo field in an NTLMSSP setup negotiation response is mishandled during session recovery.
CVE-2018-1065	2018-03-02	2023-02-13	4.7	0.04%			The netfilter subsystem in the Linux kernel through 4.15.7 mishandles the case of a rule blob that contains a jump but lacks a user-defined chain, which allows local users to cause a denial of service (NULL pointer dereference) by leveraging the CAP_NET_RAW or CAP_NET_ADMIN capability, related to arpt_do_table in net/ipv4/netfilter/arp_tables.c, ipt_do_table in net/ipv4/netfilter/ip_tables.c, and ip6t_do_table in net/ipv6/netfilter/ip6_tables.c.
CVE-2017-18344	2018-07-26	2020-10-15	5.5	0.10%			The timer_create syscall implementation in kernel/time/posix-timers.c in the Linux kernel before 4.14.8 doesn't properly validate the sigevent->sigev_notify field, which leads to out-of-bounds access in the show_timer function (called when /proc/$PID/timers is read). This allows userspace applications to read arbitrary kernel memory (on a kernel built with CONFIG_POSIX_TIMERS and CONFIG_CHECKPOINT_RESTORE).
CVE-2017-18270	2018-05-18	2020-08-14	7.1	0.04%			In the Linux kernel before 4.13.5, a local user could create keyrings for other users via keyctl commands, setting unwanted defaults or causing a denial of service.
CVE-2017-18261	2018-04-19	2019-10-03	5.5	0.04%			The arch_timer_reg_read_stable macro in arch/arm64/include/asm/arch_timer.h in the Linux kernel before 4.13 allows local users to cause a denial of service (infinite recursion) by writing to a file under /sys/kernel/debug in certain circumstances, as demonstrated by a scenario involving debugfs, ftrace, PREEMPT_TRACER, and FUNCTION_GRAPH_TRACER.
CVE-2017-18257	2018-04-04	2018-07-04	5.5	0.04%			The __get_data_block function in fs/f2fs/data.c in the Linux kernel before 4.11 allows local users to cause a denial of service (integer overflow and loop) via crafted use of the open and fallocate system calls with an FS_IOC_FIEMAP ioctl.
CVE-2017-18255	2018-03-31	2019-01-19	7.8	0.04%			The perf_cpu_time_max_percent_handler function in kernel/events/core.c in the Linux kernel before 4.11 allows local users to cause a denial of service (integer overflow) or possibly have unspecified other impact via a large value, as demonstrated by an incorrect sample-rate calculation.
